text,emergency_level,sentiment,is_emergency,disaster_type,source,verified,timestamp
Traffic delay on highway 101: 7 minute backup due to substantial accident. ID:7679,MEDIUM,NEUTRAL,True,OTHER,emergency_service,True,2024-11-02 20:33:51.294292
Minor incident: snow affecting east area. Use caution. #7336,LOW,NEUTRAL,False,WEATHER,twitter,False,2024-10-26 08:50:51.316291
Beach hazard at suburban area: severe storm causing dangerous conditions. ID:1924,MEDIUM,NEUTRAL,True,OTHER,news_agency,False,2024-11-03 06:57:51.300291
Hospital in riverside at 2% capacity. Seeking additional resources. ID:8300,HIGH,NEGATIVE,True,OTHER,twitter,True,2024-11-11 18:49:51.285293
"significant brush fire near route 27, spreading without delay. 25 acres affected. ID:7422",HIGH,NEGATIVE,True,FIRE,emergency_service,True,2024-11-03 12:01:51.284291
Regular update: Community event in riverside. #2192,NON_EMERGENCY,POSITIVE,False,NONE,twitter,False,2024-11-16 14:32:51.322290
route 27 roads flooded due to strong winds. 20 feet of water reported. ID:2362,HIGH,NEGATIVE,True,FLOOD,news_agency,True,2024-10-21 23:35:51.282296
Hospital in route 27 at 30% capacity. Seeking additional resources. ID:1844,HIGH,NEGATIVE,True,OTHER,twitter,True,2024-10-26 13:27:51.285293
Traffic delay on west end: 2 minute backup due to critical accident. ID:6267,MEDIUM,NEUTRAL,True,OTHER,public,True,2024-10-25 10:11:51.294292
metropolitan area roads flooded due to hail. 4 feet of water reported. ID:7355,HIGH,NEGATIVE,True,FLOOD,news_agency,True,2024-11-17 00:03:51.282296
"URGENT: major flooding in west end, 12 people trapped! Rescue needed as soon as possible! #emergency ID:6475",CRITICAL,PANIC,True,FLOOD,news_agency,False,2024-11-06 15:34:51.274300
Regular update: Community event in industrial zone. #5351,NON_EMERGENCY,POSITIVE,False,NONE,public,False,2024-10-19 07:10:51.322290
Regular update: Community event in downtown. #2377,NON_EMERGENCY,POSITIVE,False,NONE,news_agency,False,2024-11-12 05:26:51.323290
Minor incident: snow affecting route 27. Use caution. #8198,LOW,NEUTRAL,False,WEATHER,twitter,False,2024-10-18 19:37:51.315290
Regular update: Community event in east area. #2380,NON_EMERGENCY,POSITIVE,False,NONE,public,True,2024-11-08 23:12:51.322290
4 casualties reported in critical fire near industrial zone. Evacuate immediately! #wildfire ID:8936,CRITICAL,PANIC,True,FIRE,news_agency,True,2024-11-16 23:51:51.274300
Beach hazard at west end: hail causing dangerous conditions. ID:8922,MEDIUM,NEUTRAL,True,OTHER,twitter,True,2024-11-16 07:18:51.300291
Dam failure imminent at harbor area! 10 communities at risk. Evacuate within next hour! #flood ID:9820,CRITICAL,PANIC,True,FLOOD,news_agency,True,2024-10-27 08:05:51.281293
Beach hazard at west end: heavy rain causing dangerous conditions. ID:9418,MEDIUM,NEUTRAL,True,OTHER,news_agency,False,2024-11-06 04:47:51.300291
15 aftershocks reported in interstate 95. Magnitude considerable on Richter scale. ID:2709,HIGH,NEGATIVE,True,OTHER,public,True,2024-10-21 13:36:51.285293
Evacuation center at highway 101 reaching capacity. 30 people sheltered. ID:3420,HIGH,NEGATIVE,True,OTHER,news_agency,True,2024-11-03 08:08:51.290297
Traffic delay on city center: 2 minute backup due to substantial accident. ID:2813,MEDIUM,NEUTRAL,True,OTHER,twitter,False,2024-10-27 17:20:51.294292
Wildlife alert: extensive bear sighted in main street. Stay alert. ID:4178,MEDIUM,NEUTRAL,True,OTHER,emergency_service,True,2024-11-14 00:59:51.296292
Minor incident: dense fog affecting north district. Use caution. #9168,LOW,NEUTRAL,False,WEATHER,public,False,2024-11-09 10:31:51.316291
"URGENT: considerable flooding in east area, 2 people trapped! Rescue needed without delay! #emergency ID:9176",CRITICAL,PANIC,True,FLOOD,news_agency,True,2024-11-11 16:26:51.274300
Wildlife alert: significant bear sighted in south side. Stay alert. ID:3567,MEDIUM,NEUTRAL,True,OTHER,twitter,True,2024-10-29 07:36:51.296292
Minor incident: severe storm affecting city center. Use caution. #2422,LOW,NEUTRAL,False,WEATHER,twitter,True,2024-11-13 00:47:51.317291
Regular update: Community event in residential district. #2729,NON_EMERGENCY,POSITIVE,False,NONE,news_agency,True,2024-10-24 10:29:51.322290
Minor incident: extreme heat affecting harbor area. Use caution. #6309,LOW,NEUTRAL,False,WEATHER,news_agency,False,2024-10-24 11:33:51.316291
Minor incident: extreme heat affecting route 27. Use caution. #8854,LOW,NEUTRAL,False,WEATHER,twitter,True,2024-11-10 22:03:51.316291
Regular update: Community event in south side. #5020,NON_EMERGENCY,POSITIVE,False,NONE,twitter,True,2024-11-01 18:02:51.323290
severe accident on city center: 4 vehicles involved. Multiple injuries. Avoid area in next 30 minutes. ID:8672,CRITICAL,PANIC,True,OTHER,public,True,2024-10-26 18:01:51.279290
Minor incident: strong winds affecting main street. Use caution. #1131,LOW,NEUTRAL,False,WEATHER,public,False,2024-11-13 23:29:51.315290
Evacuation center at commercial zone reaching capacity. 8 people sheltered. ID:5626,HIGH,NEGATIVE,True,OTHER,emergency_service,False,2024-10-19 05:41:51.290297
Traffic delay on riverside: 20 minute backup due to devastating accident. ID:6679,MEDIUM,NEUTRAL,True,OTHER,twitter,True,2024-11-11 13:42:51.294292
Minor incident: lightning affecting suburban area. Use caution. #5459,LOW,NEUTRAL,False,WEATHER,twitter,True,2024-10-23 09:52:51.317291
Wildlife alert: serious bear sighted in industrial zone. Stay alert. ID:4338,MEDIUM,NEUTRAL,True,OTHER,emergency_service,True,2024-11-15 04:00:51.296292
6 traffic signals out in route 27 due to hail. ID:6118,HIGH,NEGATIVE,True,OTHER,twitter,True,2024-11-03 09:39:51.289297
Minor incident: hail affecting metropolitan area. Use caution. #9230,LOW,NEUTRAL,False,WEATHER,public,False,2024-11-03 04:13:51.316291
major hurricane with hail approaching main street. Wind speeds 50mph. Immediate evacuation ordered! ID:3356,CRITICAL,PANIC,True,HURRICANE,news_agency,False,2024-10-20 15:36:51.277291
Active shooter at commercial zone. 8 casualties reported. Police operation ongoing. Stay away! ID:8295,CRITICAL,PANIC,True,VIOLENCE,twitter,True,2024-10-30 02:23:51.280291
Regular update: Community event in metropolitan area. #9982,NON_EMERGENCY,POSITIVE,False,NONE,news_agency,False,2024-11-03 11:42:51.323290
"URGENT: extensive flooding in downtown, 2 people trapped! Rescue needed in next 30 minutes! #emergency ID:5596",CRITICAL,PANIC,True,FLOOD,news_agency,True,2024-10-20 20:54:51.274300
"critical brush fire near harbor area, spreading within next hour. 2 acres affected. ID:7061",HIGH,NEGATIVE,True,FIRE,twitter,False,2024-11-08 15:12:51.284291
Building collapsed in route 27 after serious earthquake. 6+ people trapped. Emergency services responding. ID:3858,CRITICAL,PANIC,True,EARTHQUAKE,twitter,False,2024-10-29 18:44:51.276291
ALERT: massive tornado approaching east area. 3 minutes to seek shelter! #tornado ID:6966,CRITICAL,PANIC,True,TORNADO,news_agency,True,2024-11-06 18:18:51.275300
Minor incident: extreme heat affecting west end. Use caution. #3494,LOW,NEUTRAL,False,WEATHER,twitter,True,2024-10-22 02:46:51.316291
Beach hazard at east area: lightning causing dangerous conditions. ID:9971,MEDIUM,NEUTRAL,True,OTHER,emergency_service,False,2024-11-16 11:20:51.300291
Beach hazard at highway 101: hail causing dangerous conditions. ID:3805,MEDIUM,NEUTRAL,True,OTHER,twitter,True,2024-10-31 19:10:51.300291
Water pressure issues reported in west end. 6 households affected. ID:4143,MEDIUM,NEUTRAL,True,OTHER,twitter,True,2024-11-05 16:15:51.298305
Evacuation center at central park reaching capacity. 10 people sheltered. ID:4716,HIGH,NEGATIVE,True,OTHER,emergency_service,True,2024-11-02 07:03:51.290297
Regular update: Community event in central park. #1272,NON_EMERGENCY,POSITIVE,False,NONE,news_agency,True,2024-11-03 14:37:51.322290
massive accident on commercial zone: 25 vehicles involved. Multiple injuries. Avoid area immediately. ID:4466,CRITICAL,PANIC,True,OTHER,public,True,2024-11-12 14:59:51.279290
Wildlife alert: significant bear sighted in north district. Stay alert. ID:6625,MEDIUM,NEUTRAL,True,OTHER,public,False,2024-11-03 17:23:51.296292
Water pressure issues reported in interstate 95. 10 households affected. ID:7715,MEDIUM,NEUTRAL,True,OTHER,news_agency,True,2024-10-22 00:14:51.298305
Minor incident: heavy rain affecting commercial zone. Use caution. #3818,LOW,NEUTRAL,False,WEATHER,news_agency,False,2024-11-06 22:00:51.315290
Water pressure issues reported in north district. 2 households affected. ID:2121,MEDIUM,NEUTRAL,True,OTHER,emergency_service,True,2024-11-12 21:15:51.298305
Water contamination alert for north district. Affects 9k residents. Boil advisory issued. ID:4482,HIGH,NEGATIVE,True,OTHER,news_agency,True,2024-11-07 03:54:51.286290
Evacuation center at metropolitan area reaching capacity. 7 people sheltered. ID:4337,HIGH,NEGATIVE,True,OTHER,emergency_service,True,2024-10-19 21:22:51.290297
Water pressure issues reported in city center. 15 households affected. ID:4310,MEDIUM,NEUTRAL,True,OTHER,public,False,2024-11-01 01:35:51.298305
12 traffic signals out in main street due to heavy rain. ID:2539,HIGH,NEGATIVE,True,OTHER,twitter,True,2024-10-25 03:34:51.289297
massive hurricane with severe storm approaching suburban area. Wind speeds 150mph. Immediate evacuation ordered! ID:9003,CRITICAL,PANIC,True,HURRICANE,twitter,True,2024-11-11 02:44:51.277291
Water pressure issues reported in metropolitan area. 20 households affected. ID:5349,MEDIUM,NEUTRAL,True,OTHER,news_agency,True,2024-11-08 13:27:51.298305
Missing person in central park: Last seen 10 hours ago during strong winds. ID:6169,HIGH,NEGATIVE,True,OTHER,public,False,2024-10-31 08:30:51.287291
Regular update: Community event in south side. #7509,NON_EMERGENCY,POSITIVE,False,NONE,news_agency,False,2024-11-08 13:02:51.322290
20 aftershocks reported in highway 101. Magnitude considerable on Richter scale. ID:5749,HIGH,NEGATIVE,True,OTHER,news_agency,False,2024-11-16 14:11:51.285293
Regular update: Community event in east area. #2933,NON_EMERGENCY,POSITIVE,False,NONE,twitter,True,2024-11-15 05:48:51.322290
CRITICAL: severe gas leak detected in south side. 15 block radius being evacuated now. ID:1618,CRITICAL,PANIC,True,OTHER,news_agency,False,2024-11-08 07:00:51.278290
Dam failure imminent at industrial zone! 30 communities at risk. Evacuate immediately! #flood ID:7166,CRITICAL,PANIC,True,FLOOD,public,True,2024-11-17 09:18:51.281293
Regular update: Community event in east area. #1921,NON_EMERGENCY,POSITIVE,False,NONE,news_agency,False,2024-11-05 18:48:51.323290
Power outage affecting 3k residents in industrial zone after strong winds. ID:1180,HIGH,NEGATIVE,True,OTHER,emergency_service,True,2024-10-25 09:11:51.283292
severe landslide reported near commercial zone. 15 homes at risk. ID:3155,HIGH,NEGATIVE,True,OTHER,emergency_service,False,2024-11-09 00:35:51.291297
Regular update: Community event in city center. #5122,NON_EMERGENCY,POSITIVE,False,NONE,twitter,False,2024-11-07 03:10:51.321293
"extensive brush fire near south side, spreading in next 30 minutes. 2 acres affected. ID:1868",HIGH,NEGATIVE,True,FIRE,twitter,False,2024-11-11 15:38:51.284291
Hospital in west end at 7% capacity. Seeking additional resources. ID:7851,HIGH,NEGATIVE,True,OTHER,public,False,2024-11-02 06:53:51.285293
Regular update: Community event in north district. #8235,NON_EMERGENCY,POSITIVE,False,NONE,news_agency,False,2024-11-16 11:04:51.323290
Evacuation center at main street reaching capacity. 12 people sheltered. ID:1970,HIGH,NEGATIVE,True,OTHER,public,False,2024-11-02 18:19:51.290297
"significant brush fire near metropolitan area, spreading within next hour. 9 acres affected. ID:4136",HIGH,NEGATIVE,True,FIRE,emergency_service,True,2024-10-22 12:13:51.284291
Dam failure imminent at industrial zone! 12 communities at risk. Evacuate without delay! #flood ID:7796,CRITICAL,PANIC,True,FLOOD,twitter,True,2024-10-27 11:25:51.281293
3 aftershocks reported in downtown. Magnitude major on Richter scale. ID:4935,HIGH,NEGATIVE,True,OTHER,twitter,True,2024-11-16 01:07:51.285293
Evacuation center at metropolitan area reaching capacity. 30 people sheltered. ID:9870,HIGH,NEGATIVE,True,OTHER,emergency_service,True,2024-11-15 01:00:51.290297
Regular update: Community event in suburban area. #3706,NON_EMERGENCY,POSITIVE,False,NONE,news_agency,False,2024-10-21 22:43:51.322290
critical accident on south side: 20 vehicles involved. Multiple injuries. Avoid area within next hour. ID:6443,CRITICAL,PANIC,True,OTHER,news_agency,False,2024-11-02 08:52:51.279290
Building collapsed in riverside after significant earthquake. 30+ people trapped. Emergency services responding. ID:1293,CRITICAL,PANIC,True,EARTHQUAKE,twitter,True,2024-10-31 02:21:51.276291
Traffic delay on east area: 4 minute backup due to considerable accident. ID:1510,MEDIUM,NEUTRAL,True,OTHER,twitter,True,2024-10-30 10:30:51.294292
Wildlife alert: serious bear sighted in residential district. Stay alert. ID:4707,MEDIUM,NEUTRAL,True,OTHER,twitter,True,2024-10-25 03:04:51.296292
Minor incident: severe storm affecting downtown. Use caution. #2074,LOW,NEUTRAL,False,WEATHER,news_agency,True,2024-11-16 04:10:51.317291
Hospital in metropolitan area at 4% capacity. Seeking additional resources. ID:7199,HIGH,NEGATIVE,True,OTHER,emergency_service,True,2024-11-15 08:12:51.285293
Traffic delay on metropolitan area: 7 minute backup due to significant accident. ID:9740,MEDIUM,NEUTRAL,True,OTHER,news_agency,True,2024-11-06 19:24:51.294292
Evacuation center at west end reaching capacity. 10 people sheltered. ID:1532,HIGH,NEGATIVE,True,OTHER,twitter,False,2024-11-07 14:43:51.290297
Protest scheduled at metropolitan area. Expecting 200 participants. ID:6592,MEDIUM,NEUTRAL,True,OTHER,twitter,False,2024-11-03 00:33:51.299300
significant landslide reported near industrial zone. 15 homes at risk. ID:5962,HIGH,NEGATIVE,True,OTHER,twitter,False,2024-11-07 04:18:51.291297
ALERT: severe tornado approaching north district. 30 minutes to seek shelter! #tornado ID:6286,CRITICAL,PANIC,True,TORNADO,news_agency,True,2024-10-18 18:13:51.275300
extensive accident on east area: 12 vehicles involved. Multiple injuries. Avoid area in next 30 minutes. ID:2868,CRITICAL,PANIC,True,OTHER,twitter,False,2024-11-16 11:30:51.279290
Regular update: Community event in harbor area. #3666,NON_EMERGENCY,POSITIVE,False,NONE,public,True,2024-10-27 03:39:51.322290
15 casualties reported in serious fire near suburban area. Evacuate in next 30 minutes! #wildfire ID:3722,CRITICAL,PANIC,True,FIRE,twitter,True,2024-11-03 10:18:51.274300
ALERT: severe tornado approaching metropolitan area. 3 minutes to seek shelter! #tornado ID:4358,CRITICAL,PANIC,True,TORNADO,news_agency,True,2024-11-07 04:36:51.275300
Minor incident: severe storm affecting highway 101. Use caution. #2269,LOW,NEUTRAL,False,WEATHER,twitter,True,2024-10-26 15:15:51.316291
Water contamination alert for route 27. Affects 25k residents. Boil advisory issued. ID:3041,HIGH,NEGATIVE,True,OTHER,news_agency,True,2024-11-08 19:34:51.286290
Minor incident: extreme heat affecting interstate 95. Use caution. #8897,LOW,NEUTRAL,False,WEATHER,news_agency,False,2024-10-24 20:37:51.316291
ALERT: massive tornado approaching interstate 95. 2 minutes to seek shelter! #tornado ID:7333,CRITICAL,PANIC,True,TORNADO,twitter,False,2024-10-21 13:02:51.275300
Planned power outage in industrial zone for 5 hours tomorrow. ID:5805,MEDIUM,NEUTRAL,True,OTHER,news_agency,True,2024-11-15 14:26:51.295291
severe storm forecast for industrial zone. Expected duration: 2 hours. ID:7178,MEDIUM,NEUTRAL,True,OTHER,emergency_service,True,2024-10-29 18:56:51.292292
ice forecast for harbor area. Expected duration: 3 hours. ID:5031,MEDIUM,NEUTRAL,True,OTHER,twitter,False,2024-11-15 06:21:51.292292
Planned power outage in east area for 15 hours tomorrow. ID:6383,MEDIUM,NEUTRAL,True,OTHER,twitter,True,2024-11-04 17:18:51.295291
Wildlife alert: critical bear sighted in south side. Stay alert. ID:1907,MEDIUM,NEUTRAL,True,OTHER,twitter,True,2024-10-26 20:00:51.296292
Traffic delay on main street: 2 minute backup due to significant accident. ID:5840,MEDIUM,NEUTRAL,True,OTHER,public,True,2024-10-27 10:05:51.294292
Water contamination alert for metropolitan area. Affects 3k residents. Boil advisory issued. ID:8351,HIGH,NEGATIVE,True,OTHER,news_agency,False,2024-11-04 11:22:51.286290
Dam failure imminent at harbor area! 7 communities at risk. Evacuate within next hour! #flood ID:6146,CRITICAL,PANIC,True,FLOOD,news_agency,True,2024-11-13 21:24:51.281293
Minor incident: severe storm affecting main street. Use caution. #7022,LOW,NEUTRAL,False,WEATHER,twitter,True,2024-11-03 17:07:51.315290
Minor flooding in route 27. Water level risen 20 inches due to extreme heat. ID:3328,MEDIUM,NEUTRAL,True,FLOOD,news_agency,False,2024-10-31 22:23:51.292292
CRITICAL: critical gas leak detected in highway 101. 20 block radius being evacuated now. ID:7563,CRITICAL,PANIC,True,OTHER,news_agency,True,2024-11-16 09:49:51.278290
Minor incident: strong winds affecting city center. Use caution. #5812,LOW,NEUTRAL,False,WEATHER,news_agency,False,2024-10-20 01:30:51.316291
massive hurricane with heavy rain approaching south side. Wind speeds 120mph. Immediate evacuation ordered! ID:8534,CRITICAL,PANIC,True,HURRICANE,emergency_service,True,2024-11-17 09:45:51.277291
25 aftershocks reported in highway 101. Magnitude substantial on Richter scale. ID:1749,HIGH,NEGATIVE,True,OTHER,emergency_service,False,2024-11-06 14:58:51.285293
EMERGENCY: considerable chemical spill in city center. 7 mile evacuation zone. Hazmat responding. ID:9262,CRITICAL,PANIC,True,HAZMAT,twitter,False,2024-10-18 22:46:51.279290
"URGENT: substantial flooding in central park, 4 people trapped! Rescue needed without delay! #emergency ID:1534",CRITICAL,PANIC,True,FLOOD,news_agency,False,2024-10-23 11:04:51.274300
Evacuation center at west end reaching capacity. 2 people sheltered. ID:4902,HIGH,NEGATIVE,True,OTHER,twitter,False,2024-11-09 23:00:51.290297
Missing person in east area: Last seen 8 hours ago during hail. ID:3593,HIGH,NEGATIVE,True,OTHER,emergency_service,False,2024-11-09 18:17:51.287291
Water pressure issues reported in city center. 5 households affected. ID:7187,MEDIUM,NEUTRAL,True,OTHER,public,False,2024-11-13 12:18:51.298305
ALERT: massive tornado approaching east area. 6 minutes to seek shelter! #tornado ID:3857,CRITICAL,PANIC,True,TORNADO,twitter,True,2024-11-17 07:11:51.275300
severe accident on downtown: 10 vehicles involved. Multiple injuries. Avoid area within next hour. ID:5760,CRITICAL,PANIC,True,OTHER,news_agency,True,2024-11-15 10:29:51.279290
Regular update: Community event in east area. #9527,NON_EMERGENCY,POSITIVE,False,NONE,twitter,False,2024-10-31 13:52:51.323290
Water contamination alert for residential district. Affects 4k residents. Boil advisory issued. ID:7971,HIGH,NEGATIVE,True,OTHER,emergency_service,True,2024-11-07 18:58:51.286290
substantial landslide reported near city center. 5 homes at risk. ID:6041,HIGH,NEGATIVE,True,OTHER,public,False,2024-10-22 09:35:51.291297
massive accident on city center: 5 vehicles involved. Multiple injuries. Avoid area as soon as possible. ID:7032,CRITICAL,PANIC,True,OTHER,public,True,2024-11-02 22:24:51.279290
Regular update: Community event in city center. #8976,NON_EMERGENCY,POSITIVE,False,NONE,public,True,2024-11-08 21:33:51.322290
"Construction incident at residential district. Area secured, 7 workers affected. ID:5559",MEDIUM,NEUTRAL,True,OTHER,public,True,2024-10-28 08:14:51.297292
Minor incident: dense fog affecting east area. Use caution. #6784,LOW,NEUTRAL,False,WEATHER,public,True,2024-10-20 23:20:51.316291
EMERGENCY: significant chemical spill in residential district. 3 mile evacuation zone. Hazmat responding. ID:6920,CRITICAL,PANIC,True,HAZMAT,emergency_service,True,2024-11-07 19:25:51.279290
12 casualties reported in devastating fire near residential district. Evacuate immediately! #wildfire ID:1605,CRITICAL,PANIC,True,FIRE,twitter,False,2024-10-19 20:20:51.274300
Regular update: Community event in downtown. #9738,NON_EMERGENCY,POSITIVE,False,NONE,public,False,2024-10-19 23:34:51.322290
Small fire contained in metropolitan area. 30 acres affected. No evacuations needed. ID:5802,MEDIUM,NEUTRAL,True,FIRE,news_agency,False,2024-11-09 18:13:51.293290
ALERT: serious tornado approaching city center. 7 minutes to seek shelter! #tornado ID:7012,CRITICAL,PANIC,True,TORNADO,public,True,2024-10-20 20:28:51.275300
Dam failure imminent at north district! 3 communities at risk. Evacuate without delay! #flood ID:9962,CRITICAL,PANIC,True,FLOOD,twitter,True,2024-10-25 11:44:51.281293
Traffic delay on route 27: 15 minute backup due to devastating accident. ID:2048,MEDIUM,NEUTRAL,True,OTHER,news_agency,True,2024-11-02 14:15:51.294292
Regular update: Community event in riverside. #6111,NON_EMERGENCY,POSITIVE,False,NONE,twitter,True,2024-10-23 00:29:51.323290
Regular update: Community event in interstate 95. #4191,NON_EMERGENCY,POSITIVE,False,NONE,news_agency,False,2024-11-10 16:33:51.322290
Regular update: Community event in industrial zone. #3235,NON_EMERGENCY,POSITIVE,False,NONE,twitter,True,2024-11-08 22:02:51.322290
Minor incident: hail affecting commercial zone. Use caution. #1787,LOW,NEUTRAL,False,WEATHER,news_agency,True,2024-11-14 12:51:51.317291
CRITICAL: massive gas leak detected in west end. 4 block radius being evacuated urgently. ID:6275,CRITICAL,PANIC,True,OTHER,emergency_service,True,2024-10-30 02:11:51.278290
Beach hazard at city center: strong winds causing dangerous conditions. ID:6686,MEDIUM,NEUTRAL,True,OTHER,emergency_service,True,2024-11-14 01:29:51.300291
Minor incident: snow affecting interstate 95. Use caution. #1598,LOW,NEUTRAL,False,WEATHER,public,True,2024-11-17 13:41:51.315290
Water pressure issues reported in central park. 9 households affected. ID:2702,MEDIUM,NEUTRAL,True,OTHER,news_agency,True,2024-10-23 17:12:51.298305
Regular update: Community event in suburban area. #3510,NON_EMERGENCY,POSITIVE,False,NONE,twitter,False,2024-10-21 13:29:51.323290
Minor incident: snow affecting south side. Use caution. #4971,LOW,NEUTRAL,False,WEATHER,public,False,2024-10-27 07:47:51.316291
"Construction incident at east area. Area secured, 25 workers affected. ID:2410",MEDIUM,NEUTRAL,True,OTHER,twitter,True,2024-10-24 01:04:51.297292
Regular update: Community event in east area. #9887,NON_EMERGENCY,POSITIVE,False,NONE,twitter,True,2024-11-05 08:20:51.323290
significant accident on main street: 30 vehicles involved. Multiple injuries. Avoid area urgently. ID:5548,CRITICAL,PANIC,True,OTHER,emergency_service,True,2024-10-18 20:11:51.279290
Regular update: Community event in north district. #6990,NON_EMERGENCY,POSITIVE,False,NONE,news_agency,True,2024-10-29 10:25:51.323290
Hospital in suburban area at 12% capacity. Seeking additional resources. ID:1947,HIGH,NEGATIVE,True,OTHER,twitter,False,2024-10-25 22:28:51.285293
Water pressure issues reported in harbor area. 20 households affected. ID:7550,MEDIUM,NEUTRAL,True,OTHER,emergency_service,True,2024-10-25 01:45:51.298305
main street roads flooded due to ice. 5 feet of water reported. ID:5696,HIGH,NEGATIVE,True,FLOOD,news_agency,False,2024-10-28 10:12:51.282296
massive hurricane with ice approaching route 27. Wind speeds 50mph. Immediate evacuation ordered! ID:7985,CRITICAL,PANIC,True,HURRICANE,news_agency,True,2024-11-07 06:15:51.277291
Small fire contained in south side. 3 acres affected. No evacuations needed. ID:9047,MEDIUM,NEUTRAL,True,FIRE,emergency_service,True,2024-11-03 04:57:51.293290
Regular update: Community event in east area. #1357,NON_EMERGENCY,POSITIVE,False,NONE,twitter,True,2024-10-20 14:39:51.322290
Planned power outage in residential district for 2 hours tomorrow. ID:9823,MEDIUM,NEUTRAL,True,OTHER,public,True,2024-11-03 10:05:51.295291
Minor incident: hail affecting residential district. Use caution. #8121,LOW,NEUTRAL,False,WEATHER,public,True,2024-11-05 17:26:51.316291
Missing person in industrial zone: Last seen 3 hours ago during snow. ID:9649,HIGH,NEGATIVE,True,OTHER,twitter,False,2024-10-22 22:21:51.287291
Evacuation center at route 27 reaching capacity. 9 people sheltered. ID:6170,HIGH,NEGATIVE,True,OTHER,emergency_service,True,2024-10-28 12:06:51.290297
devastating hurricane with dense fog approaching interstate 95. Wind speeds 200mph. Immediate evacuation ordered! ID:3171,CRITICAL,PANIC,True,HURRICANE,public,True,2024-10-23 19:58:51.277291
30 aftershocks reported in metropolitan area. Magnitude substantial on Richter scale. ID:2415,HIGH,NEGATIVE,True,OTHER,news_agency,False,2024-11-13 09:30:51.285293
Regular update: Community event in residential district. #4467,NON_EMERGENCY,POSITIVE,False,NONE,public,True,2024-10-20 16:02:51.323290
Regular update: Community event in commercial zone. #6901,NON_EMERGENCY,POSITIVE,False,NONE,twitter,True,2024-11-10 16:46:51.322290
Regular update: Community event in riverside. #7659,NON_EMERGENCY,POSITIVE,False,NONE,news_agency,True,2024-10-29 22:48:51.323290
Water contamination alert for metropolitan area. Affects 9k residents. Boil advisory issued. ID:1468,HIGH,NEGATIVE,True,OTHER,twitter,True,2024-11-06 02:35:51.286290
Wildlife alert: considerable bear sighted in south side. Stay alert. ID:6897,MEDIUM,NEUTRAL,True,OTHER,emergency_service,True,2024-10-22 23:55:51.296292
Hospital in route 27 at 3% capacity. Seeking additional resources. ID:2169,HIGH,NEGATIVE,True,OTHER,public,True,2024-10-30 03:42:51.285293
Minor flooding in residential district. Water level risen 6 inches due to extreme heat. ID:8770,MEDIUM,NEUTRAL,True,FLOOD,public,True,2024-11-15 19:37:51.292292
Building collapsed in suburban area after major earthquake. 8+ people trapped. Emergency services responding. ID:4999,CRITICAL,PANIC,True,EARTHQUAKE,twitter,True,2024-11-12 11:39:51.276291
Minor incident: snow affecting harbor area. Use caution. #6480,LOW,NEUTRAL,False,WEATHER,public,True,2024-10-19 07:35:51.317291
